{
  "$schema": "https://echo-ui-automation/schemas/contracts/fixture/v1",
  "fixtureId": "search-loaded",
  "schemaVersion": "1.0.0",
  "locale": "zh-Hans",
  "theme": "light",
  "dynamicTypeSize": "Large",
  "surfaceFamily": "discovery",
  "payload": {
    "query": "猫",
    "results": [
      {
        "id": "11111111-1111-1111-1111-111111111111",
        "assetId": "photo-zh-1",
        "sourceType": "photo",
        "timestamp": 1723507200,
        "originalText": null,
        "sourceLanguage": null,
        "crossLanguageMatch": false,
        "cosineSimilarity": 0.91,
        "alignmentScore": null,
        "feedbackAdjustment": null,
        "lowConfidence": false,
        "fallbackReason": null,
        "unappliedFilters": []
      },
      {
        "id": "22222222-2222-2222-2222-222222222222",
        "assetId": "note-zh-2",
        "sourceType": "note",
        "timestamp": 1723420800,
        "originalText": "昨晚在公园遇到一只橘猫，很亲人",
        "sourceLanguage": "zh-Hans",
        "crossLanguageMatch": false,
        "cosineSimilarity": 0.87,
        "alignmentScore": null,
        "feedbackAdjustment": null,
        "lowConfidence": false,
        "fallbackReason": null,
        "unappliedFilters": []
      }
    ]
  },
  "controlledVariables": ["timestamp", "id", "cosineSimilarity"],
  "version": "1.0.0"
}
