{
  "$schema": "https://echo-ui-automation/schemas/contracts/fixture/v1",
  "fixtureId": "onboarding-completed",
  "schemaVersion": "1.0.0",
  "locale": "en-US",
  "theme": "light",
  "dynamicTypeSize": "Large",
  "surfaceFamily": "task",
  "payload": {
    "currentStep": "completed",
    "privacyConsent": "agreed",
    "permissionStepIndex": "complete",
    "selectedLanguage": "en-US",
    "modelLoadProgress": 1.0
  },
  "controlledVariables": ["currentStep", "modelLoadProgress"],
  "version": "1.0.0"
}
