{
  "$schema": "https://echo-ui-automation/schemas/contracts/fixture/v1",
  "fixtureId": "memory-detail-photo-loaded",
  "schemaVersion": "1.0.0",
  "locale": "zh-Hans",
  "theme": "light",
  "dynamicTypeSize": "Large",
  "surfaceFamily": "focus",
  "payload": {
    "memoryId": "11111111-1111-1111-1111-111111111111",
    "assetId": "photo-zh-1",
    "sourceType": "photo",
    "title": "公园里的红裙子",
    "originalText": "公园里穿红裙子的女孩，在喷泉边喂鸽子，那天下午阳光很好。",
    "sourceLanguage": "zh-Hans",
    "preferredLanguage": "en-US",
    "timestamp": 1723507200,
    "tags": [
      "公园",
      "红裙子",
      "喷泉"
    ],
    "userEdited": true,
    "translationVisible": false,
    "translatedText": null,
    "translationConfidence": null,
    "mediaAssetName": "photo-park-sunset",
    "location": "西湖公园"
  },
  "controlledVariables": [
    "timestamp",
    "memoryId",
    "translation"
  ],
  "version": "1.0.0"
}
