{
  "$schema": "https://echo-ui-automation/schemas/contracts/fixture/v1",
  "fixtureId": "creation-idle",
  "schemaVersion": "1.0.0",
  "locale": "en-US",
  "theme": "light",
  "dynamicTypeSize": "Large",
  "surfaceFamily": "focus",
  "payload": {
    "templates": ["letter", "report", "poem", "timeline"],
    "selectedTemplate": null,
    "generatedContent": null,
    "sourceMemoryCount": 0,
    "promptDraft": "You are Echo, a local AI memory assistant. Focus on recent queries and feelings."
  },
  "controlledVariables": ["template", "generatedContent"],
  "version": "1.0.0"
}
