{
  "$schema": "https://echo-ui-automation/schemas/contracts/fixture/v1",
  "fixtureId": "translation-availability-checking",
  "schemaVersion": "1.0.0",
  "locale": "zh-Hans",
  "theme": "light",
  "dynamicTypeSize": "Large",
  "surfaceFamily": "focus",
  "payload": {
    "memory": {
      "memoryId": "99999999-9999-9999-9999-999999999991",
      "assetId": "note-zh-avail",
      "sourceType": "note",
      "title": "可用性检查中",
      "originalText": "这是一条正在进行语言对可用性检查的记忆。",
      "sourceLanguage": "zh-Hans",
      "preferredLanguage": "en-US",
      "timestamp": 1723756800,
      "tags": []
    },
    "translation": {
      "requestedText": "这是一条正在进行语言对可用性检查的记忆。",
      "sourceLanguage": "zh-Hans",
      "targetLanguage": "en-US",
      "translatedText": null,
      "confidence": null,
      "cacheHit": false,
      "availabilityCheckInFlight": true
    }
  },
  "controlledVariables": ["timestamp", "memoryId", "translation.availabilityCheckInFlight"],
  "version": "1.0.0"
}
