{
  "$schema": "https://echo-ui-automation/schemas/contracts/fixture/v1",
  "fixtureId": "creation-share-handoff",
  "schemaVersion": "1.0.0",
  "locale": "en-US",
  "theme": "light",
  "dynamicTypeSize": "Large",
  "surfaceFamily": "focus",
  "payload": {
    "selectedTemplate": "letter",
    "title": "A letter to your future self",
    "generatedContent": [
      {
        "paragraph": "In the summer of 2025 you spent many evenings walking in the park, and a small orange cat often followed you home.",
        "citation": {
          "memoryId": "22222222-2222-2222-2222-222222222222",
          "hasSource": true
        }
      }
    ],
    "sourceMemoryCount": 1,
    "shareHandoff": "presented",
    "finalSaveResult": "unobservable"
  },
  "controlledVariables": ["shareHandoff"],
  "version": "1.0.0"
}
