{
  "$schema": "https://echo-ui-automation/schemas/contracts/fixture/v1",
  "fixtureId": "onboarding-model-unavailable",
  "schemaVersion": "1.0.0",
  "locale": "en-US",
  "theme": "light",
  "dynamicTypeSize": "Large",
  "surfaceFamily": "task",
  "payload": {
    "currentStep": "modelLoading",
    "privacyConsent": "agreed",
    "permissionStepIndex": "complete",
    "selectedLanguage": "en-US",
    "modelLoadState": "unavailable",
    "failedModelName": "all",
    "recoveryMethod": "systemSettings",
    "loadingLabel": "Models unavailable. FTS5 keyword search remains available."
  },
  "controlledVariables": ["modelLoadState"],
  "version": "1.0.0"
}
