{
  "$schema": "https://echo-ui-automation/schemas/contracts/fixture/v1",
  "fixtureId": "translation-zh-en-low",
  "schemaVersion": "1.0.0",
  "locale": "zh-Hans",
  "theme": "light",
  "dynamicTypeSize": "Large",
  "surfaceFamily": "focus",
  "payload": {
    "memory": {
      "memoryId": "33333333-3333-3333-3333-333333333333",
      "assetId": "note-zh-3",
      "sourceType": "note",
      "title": "俚语记忆",
      "originalText": "今天整个下午都在搞这个破项目，快崩了。",
      "sourceLanguage": "zh-Hans",
      "preferredLanguage": "en-US",
      "timestamp": 1723680000,
      "tags": [
        "工作"
      ]
    },
    "translation": {
      "requestedText": "今天整个下午都在搞这个破项目，快崩了。",
      "sourceLanguage": "zh-Hans",
      "targetLanguage": "en-US",
      "translatedText": "Working on this project all afternoon.",
      "cacheHit": false,
      "sourceLanguageConfidence": 0.55
    }
  },
  "controlledVariables": [
    "timestamp",
    "memoryId",
    "translation.sourceLanguageConfidence",
    "translation.cacheHit"
  ],
  "version": "1.0.0"
}
